;Reg;Aircraft Type; Config ;Delivered;Exit Date; Status / Fate ; Remark ;;
; CC-CAR ;Douglas DC-8-71(F); Cargo ; 25 Mar 1993 ; 17 Dec 1999 ;CC-CAR Florida West International Airways ;lsd ;;
; CC-CAX ;Douglas DC-8-71(F); Cargo ; 31 Jan 1993 ; Aug 1998 ;CC-CAX MAS Air Cargo ;lsd ;;
; CC-CDS ;Douglas DC-8-71(F); Cargo ; 14 Sep 1995 ; 20 Sep 1997 ;CC-CDS LAN Chile Cargo ;lsf LAN Chile Cargo ;;
; CC-CDU ;Douglas DC-8-71(F); Cargo ; 20 Sep 1995 ; 20 Sep 1997 ;CC-CDU LAN Chile Cargo ;lsf LAN Chile Cargo ;;
; CC-CYQ ;Douglas DC-8-71(F); Cargo ; 23 Nov 1994 ; 14 Aug 1996 ;PP-ABS ABSA Cargo ;lsd ;;
